title,price,ratings,reviews,availability
Sonic Origins Plus - PlayStation 5,$39.99,Previous page of related Sponsored Products,,"This item will be released on June 23, 2023."
PlayStation PS5 Console – God of War Ragnarök Bundle,$509.00,4.8 out of 5 stars,"7,049 ratings",In Stock
PlayStation 5 Console CFI-1215A01X,$499.00,4.8 out of 5 stars,"2,485 ratings",In Stock
PlayStation DualSense Wireless Controller - Starlight Blue - PlayStation 5,$74.94,4.8 out of 5 stars,"71,945 ratings",
Minecraft Legends - Deluxe Edition PlayStation 5,$49.99,Previous page of related Sponsored Products,,"This item will be released on April 18, 2023."
PlayStation 5 Pulse 3D Wireless Headset,$97.00,4.7 out of 5 stars,"19,150 ratings",
PlayStation 5 Console CFI-1102A,$479.97,4.9 out of 5 stars,"7,201 ratings",
Marvel's Midnight Suns Enhanced Edition - PlayStation 5,$39.99,4.3 out of 5 stars,191 ratings,In Stock
Razer Quick Charging Stand for PlayStation 5: Quick Charge - Curved Cradle Design - Matches PS5 DualSense Wireless Controller - One-Handed Navigation - USB Powered - Pink (Controller Sold Separately),$29.99,4.8 out of 5 stars,"1,320 ratings",In Stock
"PowerA Ultra High Speed HDMI Cable for PlayStation 5, cable, HDMI 2.1, PS5, officially licensed",$39.99,4.8 out of 5 stars,"2,417 ratings",In Stock
Playstation Media Remote,$29.99,4.6 out of 5 stars,"9,721 ratings",In Stock
"PS5 Stand with Cooling Fan,2 Cooling Fans,Dual Controller Charger Station for Playstation 5 UHD & DE, PS5 Accessories Cooling Stand, with Charging Dock Station&8 Games Storage, 2 IN1 Cable Included,USB Type-C,Low Noise Design,High-Speed Charging,Save Time,Easy to install, Integrated Multifunction,Efficient PS5 Cooling Station,All-In-One Design,White",$37.99,4.4 out of 5 stars,122 ratings,
Sackboy: A Big Adventure – PlayStation 5,$35.00,4.8 out of 5 stars,"3,582 ratings",
PlayStation 5 HD Camera,$54.79,4.6 out of 5 stars,538 ratings,
"OIVO PS5 Stand Suction Cooling Station with AC Adapter，PS5 Controller Charging Station for Playstation 5 Console, PS5 Cooling Fan Stand, PS5 Controller Charger Accessories, 12 Slots, Headset Holder",$52.99,4.5 out of 5 stars,"12,529 ratings",
$50 PlayStation Store Gift Card [Digital Code],$50.00,4.7 out of 5 stars,"257,554 ratings",Available now
"OCG Gaming Headsets 2.4GHz Bluetooth Wireless Gaming Headphones for PS5 PS4 PC with Retractable Microphone,RGB Light Wireless Headset Wired Mode for Mac Switch PS2 White",$69.99,4.5 out of 5 stars,56 ratings,
NBA 2K23 - PlayStation 5,$19.99,4.7 out of 5 stars,921 ratings,In Stock
"BINNUNE Dual Wireless Gaming Headset with Microphone for PC PS4 PS5 Playstation 4 5, 2.4G Wireless Bluetooth USB Gamer Headphones with Mic for Laptop Computer",$59.99,4.0 out of 5 stars,34 ratings,
"Heiko Premium ABS Replacement Shell for PS5 Disc Edition, Upgrade Your Console with This Heiko Replacement Shell Featuring Cooling Vents and a Sleek Design, Easy to Install and fits Perfectly(Black)",$34.99,4.5 out of 5 stars,9 ratings,
"targeal Gaming Headset with Microphone - 7.1 Surround Sound/USB Wired/Detachable Microphone/Breathable Cushions - Gamer Headphone for PS5/ PS4/ Switch/PC/Laptop/Mac,with USB Type C Cable",$38.99,4.4 out of 5 stars,12 ratings,
"OCG Wireless Gaming Headset, Bluetooth Headphones with Microphone 2.4GHz USB Connection for PC, PS5,Smartphone,MacBook,Notebook,Tablet 50mm Drivers Gamer Wireless Headsets",$59.99,4.3 out of 5 stars,53 ratings,
